[
  {
    "id": "men.f.blessing-of-the-first-gift",
    "name": "Blessing of the First Gift",
    "text": "Every enemy model and unit inside her CTRL catches fire.",
    "effect": [
      {
        "code": "blessingOfTheFirstGift"
      }
    ],
    "scope": {
      "who": "enemy",
      "range": "CTRL"
    },
    "duration": "instant",
    "verify": "Card (S1): the feat only sets enemies in CTRL on fire. The blessingOfTheFirstGift hook also rolls POW 12 fire damage first (our earlier guess); that roll must be dropped in menoth.ts."
  }
]
